representative	grouped_terms	genes
organelle inner membrane	organelle inner membrane;mitochondrial inner membrane	MRPS7;HADHB;SPG7;TOMM40;ATP5MC3;NDUFV3;FOXRED1;SLC25A37;SLC25A19;PGS1;EFHD1;MRPS26;MRPL4;SLC25A16;MRPL27;ALDH18A1;LETM1;NDUFB9;NDUFV1;MRPL28;COX6C;TTC19;NDUFB1;UQCRQ;MRPL43;ATAD3B;MRPS2;MRPS5;NDUFS4;MICU3;MPC1;MRPS25;TIMM13;MRPL48;COX16;ATP5MG;SLC25A20;MRPL36;MTHFD2L;UQCR10;NDUFS2;SFXN2;MRPS15;ATP5MC1;TIMM8B;MGARP;ATP5PO;NDUFS6;NDUFS5;ATP5PD;COX5A;NDUFS7;ATP5MK;SLC25A41;SLC25A1;ATP5MJ;NDUFB10;UCP2;CHCHD1;MRPS21;COX7A1;CHCHD6;NDUFA2;MRPL41;MRPL11;OXA1L;BCL2L1;MRPS34;COX4I1;NDUFB2;MRPL32;SLC25A23;HADHA;MRPL9;MRPL55;UQCRH;MCUR1;NDUFA12;TIMM50;ATP5ME;SLC25A10;COX7C;MRPL12;ATP5F1D;COX7B;MRPL51;COA3;NDUFA4;NDUFS8;TIMM10;MPV17;NDUFAF2;NDUFB4;SFXN1;MRPS24;MRPL21;NDUFAF3;DMAC1;MRPL38;HIGD2A;NDUFA1;UQCC2;AURKAIP1;NDUFB7;PHB2;TIMM44;ATAD3A;ATP5MF;TMEM11;SLC25A33;MRPS11;UQCR11;NDUFB8;MRPS6;SHMT2;ENDOG;COX7A2;MCUB;SLC25A5;NDUFA11;MTG1;COX20;SLC25A34;GADD45GIP1;MRPL37;MRPL57;MRPS18C;SCO2;COX5B;MRPL14;ATP5MC2;MICOS10;PET100;ATP5F1E;OTC;SLC25A39;COX6B1;MICOS13;NDUFB11;TRAP1;MRPL17;SLC25A18;MRPL2;TIMM17B;SLC25A42;NDUFA13;NDUFC2;MRPL52;MRPL20;COX6A1;CKMT1A;COX6B2;COX8A;MTFP1;ACADVL;ROMO1;MRPL54;CKMT1B;PDE2A;BOK;MRPS18A;ALAS2;UCP1
inner mitochondrial membrane protein complex	inner mitochondrial membrane protein complex;membrane protein complex	NDUFB9;NDUFV1;COX6C;NDUFB1;UQCRQ;NDUFS4;MICU3;MPC1;ATP5MG;UQCR10;NDUFS2;ATP5MC1;ATP5PO;NDUFS6;NDUFS5;ATP5PD;COX5A;NDUFS7;ATP5MK;ATP5MJ;NDUFB10;COX7A1;CHCHD6;NDUFA2;COX4I1;NDUFB2;UQCRH;NDUFA12;TIMM50;ATP5ME;COX7C;ATP5F1D;COX7B;NDUFA4;NDUFS8;TIMM10;NDUFB4;DMAC1;NDUFA1;NDUFB7;PHB2;TIMM44;ATP5MF;UQCR11;NDUFB8;COX7A2;MCUB;NDUFA11;COX5B;ATP5MC2;MICOS10;ATP5F1E;COX6B1;MICOS13;NDUFB11;TIMM17B;NDUFA13;NDUFC2;COX6A1;COX8A;ROMO1;SPG7;TOMM40;ATP5MC3;NDUFV3;TOMM5;FOXRED1;BCL2;TOMM7;HTRA2;TOMM6;SLC25A5;COX6B2
energy derivation by oxidation of organic compounds	energy derivation by oxidation of organic compounds;cellular respiration;generation of precursor metabolites and energy	CHCHD5;ATP5PO;NDUFS6;NDUFS5;ATP5PD;COX5A;NDUFS7;MTFR1;DGUOK;NDUFB10;AIFM2;COX7A1;NDUFA2;OXA1L;IDH3B;COX4I1;NDUFB2;SLC25A23;UQCRH;NDUFA12;ATP5ME;BNIP3;COX7C;ATP5F1D;IDH3G;COX7B;NDUFA4;NDUFS8;NDUFB4;NDUFA1;UQCC2;NDUFB7;SDHAF4;BLOC1S1;ADCY10;ANTKMT;ATP5MF;ETFB;SLC25A33;UQCR11;NDUFB8;SHMT2;COX7A2;NDUFA11;ARL2;SCO2;COX5B;PRELID1;ATP5F1E;COX6B1;NDUFB11;TRAP1;SLC25A18;NDUFA13;NDUFC2;CHCHD2;COX6A1;COX6B2;COX8A;ACADVL;PARK7;UCP2;OXCT1;PHB2;HMGCS2
respiratory chain complex	respiratory chain complex;respirasome;mitochondrial respirasome	NDUFA7;NDUFV3;FOXRED1;NDUFB9;NDUFV1;COX6C;NDUFB1;UQCRQ;NDUFS4;UQCR10;NDUFS2;NDUFS6;NDUFS5;COX5A;NDUFS7;NDUFB10;COX7A1;NDUFA2;COX4I1;NDUFB2;UQCRH;NDUFA12;COX7C;COX7B;NDUFA4;NDUFS8;NDUFB4;DMAC1;NDUFA1;NDUFB7;UQCR11;NDUFB8;COX7A2;NDUFA11;COX5B;COX6B1;NDUFB11;NDUFA13;NDUFC2;COX6A1;COX6B2;COX8A;TTC19;HIGD2A
proton motive force-driven ATP synthesis	proton motive force-driven ATP synthesis;ATP metabolic process;ATP biosynthetic process;proton motive force-driven mitochondrial ATP synthesis;purine nucleoside triphosphate metabolic process;nucleoside triphosphate metabolic process;purine nucleoside triphosphate biosynthetic process;ribonucleoside triphosphate biosynthetic process;purine ribonucleoside triphosphate biosynthetic process;nucleoside triphosphate biosynthetic process;ribonucleoside triphosphate metabolic process;purine ribonucleoside triphosphate metabolic process	NDUFA7;ATP5MC3;NDUFV3;NDUFB9;NDUFV1;NDUFB1;NDUFS4;ATP5MG;NDUFS2;ATP5MC1;ATP5PO;NDUFS6;NDUFS5;ATP5PD;NDUFS7;ATP5MK;ATP5MJ;NDUFB10;NDUFA2;NDUFB2;NDUFA12;ATP5ME;ATP5F1D;NDUFS8;NDUFB4;NDUFA1;NDUFB7;ANTKMT;ATP5MF;NDUFB8;NDUFA11;ATP5MC2;ATP5F1E;NDUFB11;NDUFA13;NDUFC2;NUDT5;UCP2;ADCY10;AK2;FIS1;TSPO;ARL2;DGUOK;DTYMK
oxidative phosphorylation	oxidative phosphorylation;aerobic respiration	NDUFB9;NDUFV1;COX6C;NDUFB1;UQCRQ;BID;NDUFS4;ATP5MG;UQCR10;NDUFS2;ATP5PO;NDUFS6;NDUFS5;ATP5PD;COX5A;NDUFS7;DGUOK;NDUFB10;COX7A1;NDUFA2;COX4I1;NDUFB2;SLC25A23;UQCRH;NDUFA12;ATP5ME;COX7C;ATP5F1D;COX7B;NDUFA4;NDUFS8;NDUFB4;NDUFA1;UQCC2;NDUFB7;ANTKMT;ATP5MF;SLC25A33;UQCR11;NDUFB8;SHMT2;COX7A2;NDUFA11;COX5B;ATP5F1E;COX6B1;NDUFB11;NDUFA13;NDUFC2;CHCHD2;COX6A1;COX6B2;COX8A;PARK7;PANK2;MTFR1;OXA1L;IDH3B;BNIP3;IDH3G;BLOC1S1;ARL2
proton transmembrane transport	proton transmembrane transport;proton transmembrane transporter activity;monoatomic ion transmembrane transporter activity;inorganic molecular entity transmembrane transporter activity;monoatomic cation transmembrane transporter activity;inorganic cation transmembrane transporter activity	ATP5MG;UQCR10;ATP5MC1;ATP5PO;ATP5PD;COX5A;NDUFS7;UCP2;COX7A1;COX4I1;UQCRH;ATP5ME;ATP5F1D;COX7B;NDUFA4;PHB2;ANTKMT;ATP5MF;SLC25A5;COX5B;ATP5MC2;ATP5F1E;COX6B1;SLC25A18;COX8A;UCP1;SFXN3;SFXN2;SFXN1;SLC25A23;SLC25A10
ATP synthesis coupled electron transport	ATP synthesis coupled electron transport;mitochondrial ATP synthesis coupled electron transport;respiratory electron transport chain;aerobic electron transport chain	NDUFB9;NDUFV1;COX6C;NDUFB1;UQCRQ;BID;NDUFS4;UQCR10;NDUFS2;NDUFS6;NDUFS5;COX5A;NDUFS7;DGUOK;NDUFB10;COX7A1;NDUFA2;COX4I1;NDUFB2;UQCRH;NDUFA12;COX7C;COX7B;NDUFA4;NDUFS8;NDUFB4;NDUFA1;NDUFB7;UQCR11;NDUFB8;COX7A2;COX5B;COX6B1;NDUFC2;CHCHD2;COX6A1;COX8A;PARK7;AIFM2;ETFB;SCO2;SLC25A18
mitochondrial respiratory chain complex I	mitochondrial respiratory chain complex I;NADH dehydrogenase complex;respiratory chain complex I;transmembrane transporter complex;transporter complex;NADH dehydrogenase (ubiquinone) activity;oxidoreductase activity, acting on NAD(P)H, quinone or similar compound as acceptor;NADH dehydrogenase (quinone) activity;NADH dehydrogenase activity;NAD(P)H dehydrogenase (quinone) activity	NDUFA7;NDUFV3;FOXRED1;NDUFB9;NDUFV1;NDUFB1;NDUFS4;NDUFS2;NDUFS6;NDUFS5;NDUFS7;NDUFB10;NDUFA2;NDUFB2;NDUFA12;NDUFA4;NDUFS8;NDUFB4;DMAC1;NDUFA1;NDUFB7;NDUFB8;NDUFA11;NDUFB11;NDUFA13;NDUFC2;UQCRQ;MICU3;UQCR10;UQCRH;UQCR11;MCUB;TIMM13;TIMM8B;TIMM10;CRYZ;AIFM2;DCXR
respiratory chain complex IV	respiratory chain complex IV;mitochondrial respiratory chain complex IV	COX5A;COX7A1;COX4I1;COX7C;COX7B;NDUFA4;COX7A2;COX5B;COX6B1;COX6A1;COX6B2;COX8A
regulation of transcription by RNA polymerase II	regulation of transcription by RNA polymerase II;transcription by RNA polymerase II	TSTD1;CHCHD2;PARK7;PDE2A;UCP1
carbohydrate derivative biosynthetic process	carbohydrate derivative biosynthetic process;purine ribonucleotide biosynthetic process;purine nucleotide biosynthetic process;purine-containing compound biosynthetic process;ribonucleotide biosynthetic process;ribose phosphate biosynthetic process;nucleotide biosynthetic process;nucleoside phosphate biosynthetic process	GOLPH3;CMPK2;NDUFB6;TAFAZZIN;ACLY;NDUFA7;ATP5MC3;NDUFV3;ACACB;NDUFB9;PDK2;NDUFV1;PANK2;NDUFB1;NDUFS4;ATP5MG;NDUFS2;MLYCD;ATP5MC1;PDK4;ATP5PO;NDUFS6;NDUFS5;BCL2;ATP5PD;NDUFS7;ATP5MK;SLC25A1;DGUOK;ATP5MJ;NDUFB10;NDUFA2;GUK1;NDUFB2;ACOT7;NDUFA12;ATP5ME;SLC25A10;ATP5F1D;NDUFS8;NDUFB4;NDUFA1;NDUFB7;ACSL1;ADCY10;ANTKMT;ATP5MF;AK2;DTYMK;NDUFB8;NDUFA11;DCXR;ATP5MC2;ATP5F1E;PDK1;NDUFB11;NDUFA13;NDUFC2;NADK2;MTHFD2L;GARS1
structural constituent of ribosome	structural constituent of ribosome;structural molecule activity;ribosomal subunit;organellar ribosome;mitochondrial ribosome;ribosome;ribonucleoprotein complex	MRPL34;MRPL18;NDUFA7;MRPS7;MRPL4;MRPL27;MRPL28;MRPL43;MRPS2;MRPS5;MRPS25;MRPL36;MRPS15;MRPS21;MRPL41;MRPL11;MRPS34;MRPL32;MRPL9;MRPL55;MRPL12;MRPL51;MRPS24;MRPL21;MRPS11;MRPS6;MRPL37;MRPL57;MRPS18C;MRPL14;MRPL17;MRPL2;MRPL52;MRPL20;MRPL54;MRPS18A;CPOX;MRPS26;MRPL48;CHCHD1;MRPL38;AURKAIP1;MTG1;GADD45GIP1;SND1;HSD17B10;SLIRP
organellar ribosome	organellar ribosome;mitochondrial ribosome	MRPS26;MRPL4;MRPL27;MRPL28;MRPL43;MRPS2;MRPS5;MRPS25;MRPL48;MRPL36;MRPS15;CHCHD1;MRPS21;MRPL41;MRPL11;MRPS34;MRPL32;MRPL9;MRPL55;MRPL12;MRPL51;MRPS24;MRPL21;MRPL38;AURKAIP1;MRPS11;MRPS6;MTG1;GADD45GIP1;MRPL37;MRPL57;MRPS18C;MRPL14;MRPL17;MRPL2;MRPL52;MRPL20;MRPL54;MRPS18A
transmembrane transporter activity	transmembrane transporter activity;transporter activity	SLC25A11;SLC25A28;SLC25A22;NDUFA7;TOMM40;ATP5MC3;NDUFV3;SLC25A37;SLC25A19;SLC25A16;LETM1;NDUFB9;NDUFV1;NDUFB1;NDUFS4;MPC1;SFXN3;ATP5MG;SLC25A20;UQCR10;NDUFS2;SFXN2;ATP5MC1;ATP5PO;NDUFS6;NDUFS5;BCL2;ATP5PD;COX5A;NDUFS7;SLC25A41;SLC25A1;NDUFB10;UCP2;COX7A1;NDUFA2;COX4I1;TOMM7;NDUFB2;SLC25A23;UQCRH;NDUFA12;ATP5ME;SLC25A10;ATP5F1D;COX7B;NDUFA4;NDUFS8;MPV17;NDUFB4;SFXN1;NDUFA1;NDUFB7;ATP5MF;SLC25A33;NDUFB8;SLC25A5;COX5B;ATP5MC2;ATP5F1E;COX6B1;SLC25A18;TIMM17B;SLC25A42;NDUFC2;COX8A;UCP1;TIMM8B;PRELID3B;TSPO;PRELID1
organellar large ribosomal subunit	organellar large ribosomal subunit;mitochondrial large ribosomal subunit;large ribosomal subunit	MRPL41;MRPL11;MRPL32;MRPL9;MRPL55;MRPL12;MRPL51;MRPL21;MRPL38;GADD45GIP1;MRPL37;MRPL57;MRPL14;MRPL17;MRPL2;MRPL52;MRPL20;MRPL54;MRPS18A
oxidoreduction-driven active transmembrane transporter activity	oxidoreduction-driven active transmembrane transporter activity;primary active transmembrane transporter activity	NDUFA7;NDUFV3;NDUFB9;NDUFV1;NDUFB1;NDUFS4;UQCR10;NDUFS2;NDUFS6;NDUFS5;COX5A;NDUFS7;NDUFB10;COX7A1;NDUFA2;COX4I1;NDUFB2;UQCRH;NDUFA12;COX7B;NDUFA4;NDUFS8;NDUFB4;NDUFA1;NDUFB7;NDUFB8;COX5B;COX6B1;NDUFC2;COX8A
regulation of cell population proliferation	regulation of cell population proliferation;cell population proliferation	COX17;BID;NDUFS4;TBRG4;PRDX4;ARG2;FTH1;BCL2;GPAM;BCL2L1;PHB2;SLC25A33;SHMT2;SLC25A5;TSPO;GPX1;FMC1;ROMO1;BOK;NDUFS2;PRDX2;PDK1
negative regulation of cell communication	negative regulation of cell communication;negative regulation of signaling	BCL2;UCP2;BCL2L1;ACAA2;CRY1;NDUFAF2;HTRA2;PHB2;PRDX2;ENDOG;PYCR1;SLC25A5;TSPO;PRELID1;GPX1;TRAP1;LONP1;NDUFA13;PARK7;PDE2A;BOK
organic cyclic compound biosynthetic process	organic cyclic compound biosynthetic process;nucleobase-containing compound biosynthetic process	GLRX2;ALDH18A1;NDUFB9;PDK2;NDUFV1;PRDX5;PANK2;GARS1;NDUFB1;MTHFD1L;GFER;NDUFS4;SOD1;CPOX;NADK2;ATP5MG;MTHFD2L;NDUFS2;MLYCD;ATP5MC1;PTGES2;PDK4;ATP5PO;NDUFS6;NDUFS5;ATP5PD;NDUFS7;ATP5MK;SLC25A1;DGUOK;ATP5MJ;NDUFB10;POLRMT;NDUFA2;GUK1;ACAA2;POLG2;MOCS1;NDUFB2;ACOT7;CRY1;NDUFA12;ATP5ME;MRPL12;ATP5F1D;FDPS;MTHFS;NDUFS8;NDUFB4;NDUFA1;NDUFB7;ACSL1;PHB2;ADCY10;ANTKMT;HINT1;ATP5MF;SLC25A33;AK2;DTYMK;NDUFB8;PYCR1;NDUFA11;TSPO;HSD17B10;ATP5MC2;LIG3;ATP5F1E;SLC25A39;PDK1;NDUFB11;NDUFA13;NDUFC2;TSTD1;CHCHD2;HMGCS2;PARK7;PDE2A;ALAS2;UCP1
cellular nitrogen compound biosynthetic process	cellular nitrogen compound biosynthetic process;organonitrogen compound biosynthetic process	MRPS26;MRPL4;GLRX2;MRPL27;NDUFB9;PDK2;NDUFV1;PRDX5;MRPL28;WARS2;DARS2;PANK2;GARS1;NDUFB1;MTHFD1L;GFER;MRPL43;MTARC2;MRPS2;MRPS5;NDUFS4;RARS2;MRPS25;CPOX;MRPL48;NADK2;ATP5MG;MRPL36;MTHFD2L;NDUFS2;MLYCD;MRPS15;ATP5MC1;PTGES2;PDK4;GATB;ARG2;ATP5PO;NDUFS6;NDUFS5;RMND1;ATP5PD;NDUFS7;ATP5MK;SLC25A1;DGUOK;ATP5MJ;NDUFB10;CHCHD1;MRPS21;POLRMT;NDUFA2;MRPL41;MRPL11;GUK1;MRPS34;POLG2;NDUFB2;MRPL32;RPUSD3;ACOT7;MRPL9;CRY1;MRPL55;NDUFA12;ATP5ME;MRPL12;ATP5F1D;MRPL51;MTHFS;COA3;NDUFS8;NDUFB4;MRPS24;MRPL21;MRPL38;NDUFA1;UQCC2;AURKAIP1;NDUFB7;ACSL1;PHB2;MRRF;ADCY10;ANTKMT;HINT1;ATP5MF;SLC25A33;MRPS11;AK2;DTYMK;NDUFB8;MRPS6;SHMT2;NDUFA11;MTG1;GADD45GIP1;MRPL37;MRPL57;MRPS18C;TSPO;NAGS;MTARC1;MRPL14;ATP5MC2;LIG3;ATP5F1E;OTC;SLC25A39;PDK1;NDUFB11;TRAP1;MRPL17;MRPL2;NDUFA13;NDUFC2;MRPL52;TSTD1;MRPL20;CHCHD2;PARK7;MRPL54;PDE2A;MRPS18A;ALAS2;UCP1;ACACB;ALDH18A1;DBI;BCL2;MOCS1;PYCR1;GLS2;CKMT1A;CKMT1B
